<?xml version="1.0" encoding="UTF-8"?>

<!DOCTYPE emails SYSTEM "Ejercicio2.dtd">


<emails>

  <email>
  
  <para>Pepe el del girasol</para><!ELEMENT nombre (#PCDATA)>
  <cc>juanito</cc>
  <cco>juan</cco>
  <asunto><Asus/></asunto>
  <texto></texto>
  <adjunto>
  
  	<nombre></nombre>
  	<mimetype></mimetype>
  	<longitud></longitud>
  	
  </adjunto>	
  </email>
</emails>

  
  	
